{"changeId":"establish-investigation-first-planning","kind":"execution-artifact","schemaVersion":1,"tasks":{"1.1":{"allowedPaths":["docs/CURRENT_AND_NEXT_STEPS.md"],"diffReview":"policy-required","enforcement":"available","exemptionKind":"narrowly-scoped-non-behavioral","exemptionReason":"This entry only carries an already completed task from the immutable legacy plan into the v2 execution manifest; it authorizes no new implementation and makes no claim that a v2 execution strategy ran historically.","legacyBootstrap":null,"requiredChecks":["managed-documents","openspec-assets","workflow-tests","workflow-typecheck","workflow-lint","workflow-format"],"strategy":"direct-reviewed"},"1.2":{"allowedPaths":["packages/workflow-engine/src/check-runner.ts","packages/workflow-engine/src/cli.ts","packages/workflow-engine/src/errors.ts","packages/workflow-engine/src/git-transitions.ts","packages/workflow-engine/src/git.ts","packages/workflow-engine/src/handoff.ts","packages/workflow-engine/src/lifecycle-context.ts","packages/workflow-engine/src/lifecycle.ts","packages/workflow-engine/src/projected-finalization.ts","packages/workflow-engine/src/report-store.ts","packages/workflow-engine/src/report-validation.ts","packages/workflow-engine/src/session-store.ts","packages/workflow-engine/src/task-projection.ts","packages/workflow-engine/src/verification.ts","packages/workflow-engine/test/completion.integration.test.ts","packages/workflow-engine/test/contracts.test.ts","packages/workflow-engine/test/fixture.ts","packages/workflow-engine/test/session.integration.test.ts"],"diffReview":"policy-required","enforcement":"available","exemptionKind":"narrowly-scoped-non-behavioral","exemptionReason":"This entry only carries an already completed task from the immutable legacy plan into the v2 execution manifest; it authorizes no new implementation and makes no claim that a v2 execution strategy ran historically.","legacyBootstrap":null,"requiredChecks":["managed-documents","openspec-assets","workflow-tests","workflow-typecheck","workflow-lint","workflow-format"],"strategy":"direct-reviewed"},"2.1":{"allowedPaths":["packages/workflow-engine/src/canonical-json.ts","packages/workflow-engine/src/errors.ts","packages/workflow-engine/src/evidence-node.ts","packages/workflow-engine/src/evidence-object-store.ts","packages/workflow-engine/src/paths.ts","packages/workflow-engine/test/contracts.test.ts","packages/workflow-engine/test/evidence-node.contract.test.ts"],"diffReview":"policy-required","enforcement":"available","exemptionKind":"narrowly-scoped-non-behavioral","exemptionReason":"This entry only carries an already completed task from the immutable legacy plan into the v2 execution manifest; it authorizes no new implementation and makes no claim that a v2 execution strategy ran historically.","legacyBootstrap":null,"requiredChecks":["managed-documents","openspec-assets","workflow-tests","workflow-typecheck","workflow-lint","workflow-format"],"strategy":"direct-reviewed"},"2.2":{"allowedPaths":["packages/workflow-engine/src/evidence-convergence.ts","packages/workflow-engine/src/evidence-currentness.ts","packages/workflow-engine/src/evidence-node.ts","packages/workflow-engine/src/planning-assurance-validator.ts","packages/workflow-engine/test/contracts.test.ts","packages/workflow-engine/test/evidence-currentness.contract.test.ts"],"diffReview":"policy-required","enforcement":"available","exemptionKind":"narrowly-scoped-non-behavioral","exemptionReason":"This entry only carries an already completed task from the immutable legacy plan into the v2 execution manifest; it authorizes no new implementation and makes no claim that a v2 execution strategy ran historically.","legacyBootstrap":null,"requiredChecks":["managed-documents","openspec-assets","workflow-tests","workflow-typecheck","workflow-lint","workflow-format"],"strategy":"direct-reviewed"},"2.3":{"allowedPaths":["packages/workflow-engine/src/actor-identity.ts","packages/workflow-engine/src/ai-adapter-cli.ts","packages/workflow-engine/src/ai-adapter-evaluation.ts","packages/workflow-engine/src/ai-adapter-policy.ts","packages/workflow-engine/src/provider-contracts.ts","packages/workflow-engine/src/provider-registry.ts","packages/workflow-engine/src/role-scheduler.ts","packages/workflow-engine/test/ai-adapter-evaluation.integration.test.ts","packages/workflow-engine/test/contracts.test.ts","packages/workflow-engine/test/provider-orchestration.contract.test.ts","workflow/ai-adapter-policy.json","workflow/schemas/ai-adapter-policy.schema.json"],"diffReview":"policy-required","enforcement":"available","exemptionKind":"narrowly-scoped-non-behavioral","exemptionReason":"This entry only carries an already completed task from the immutable legacy plan into the v2 execution manifest; it authorizes no new implementation and makes no claim that a v2 execution strategy ran historically.","legacyBootstrap":null,"requiredChecks":["managed-documents","openspec-assets","workflow-tests","workflow-typecheck","workflow-lint","workflow-format"],"strategy":"direct-reviewed"},"3.1":{"allowedPaths":["packages/workflow-engine/src/git.ts","packages/workflow-engine/src/investigation-floor.ts","packages/workflow-engine/src/investigation-scanner.ts","packages/workflow-engine/src/investigation-terms.ts","packages/workflow-engine/src/tracked-tree-reader.ts","packages/workflow-engine/test/fixture.ts","packages/workflow-engine/test/investigation-scanner.integration.test.ts","packages/workflow-engine/test/session.integration.test.ts"],"diffReview":"policy-required","enforcement":"available","exemptionKind":"narrowly-scoped-non-behavioral","exemptionReason":"This entry only carries an already completed task from the immutable legacy plan into the v2 execution manifest; it authorizes no new implementation and makes no claim that a v2 execution strategy ran historically.","legacyBootstrap":null,"requiredChecks":["managed-documents","openspec-assets","workflow-tests","workflow-typecheck","workflow-lint","workflow-format"],"strategy":"direct-reviewed"},"3.2":{"allowedPaths":["packages/workflow-engine/src/evidence-currentness.ts","packages/workflow-engine/src/investigation-groups.ts","packages/workflow-engine/src/investigation-scanner.ts","packages/workflow-engine/src/mutation-class-policy.ts","packages/workflow-engine/test/contracts.test.ts","packages/workflow-engine/test/investigation-groups.contract.test.ts","packages/workflow-engine/test/investigation-scanner.integration.test.ts"],"diffReview":"policy-required","enforcement":"available","exemptionKind":"narrowly-scoped-non-behavioral","exemptionReason":"This entry only carries an already completed task from the immutable legacy plan into the v2 execution manifest; it authorizes no new implementation and makes no claim that a v2 execution strategy ran historically.","legacyBootstrap":null,"requiredChecks":["managed-documents","openspec-assets","workflow-tests","workflow-typecheck","workflow-lint","workflow-format"],"strategy":"direct-reviewed"},"4.1":{"allowedPaths":["packages/workflow-engine/src/investigation-design-projection.ts","packages/workflow-engine/src/investigation-why.ts","packages/workflow-engine/src/markdown-sections.ts","packages/workflow-engine/test/contracts.test.ts","packages/workflow-engine/test/fixture.ts","packages/workflow-engine/test/investigation-why.integration.test.ts","packages/workflow-engine/test/session.integration.test.ts"],"diffReview":"policy-required","enforcement":"available","exemptionKind":"narrowly-scoped-non-behavioral","exemptionReason":"This entry only carries an already completed task from the immutable legacy plan into the v2 execution manifest; it authorizes no new implementation and makes no claim that a v2 execution strategy ran historically.","legacyBootstrap":null,"requiredChecks":["managed-documents","openspec-assets","workflow-tests","workflow-typecheck","workflow-lint","workflow-format"],"strategy":"direct-reviewed"},"4.2":{"allowedPaths":["openspec/schemas/expense-app-v2/**","packages/workflow-engine/src/contracts.ts","packages/workflow-engine/src/managed-change-contract.ts","packages/workflow-engine/src/openspec-adapter.ts","packages/workflow-engine/src/openspec-doctor.ts","packages/workflow-engine/src/openspec-payloads.ts","packages/workflow-engine/src/openspec-schema-contract.ts","packages/workflow-engine/test/contracts.test.ts","packages/workflow-engine/test/fixture.ts","packages/workflow-engine/test/managed-change-contract.integration.test.ts","packages/workflow-engine/test/openspec-adapter.integration.test.ts","packages/workflow-engine/test/openspec-doctor.integration.test.ts","packages/workflow-engine/test/openspec-schema-contract.integration.test.ts","packages/workflow-engine/test/session.integration.test.ts","workflow/schemas/execution-artifact.schema.json","workflow/schemas/investigation-artifact.schema.json","workflow/schemas/plan-review-artifact.schema.json"],"diffReview":"policy-required","enforcement":"available","exemptionKind":"narrowly-scoped-non-behavioral","exemptionReason":"This entry only carries an already completed task from the immutable legacy plan into the v2 execution manifest; it authorizes no new implementation and makes no claim that a v2 execution strategy ran historically.","legacyBootstrap":null,"requiredChecks":["managed-documents","openspec-assets","workflow-tests","workflow-typecheck","workflow-lint","workflow-format"],"strategy":"direct-reviewed"},"4.3":{"allowedPaths":["packages/workflow-engine/src/archive-eligibility.ts","packages/workflow-engine/src/archive-transformation.ts","packages/workflow-engine/src/planning-contract.ts","packages/workflow-engine/src/planning-paths.ts","packages/workflow-engine/src/planning-transition.ts","packages/workflow-engine/test/archive-eligibility.integration.test.ts","packages/workflow-engine/test/archive-transformation.integration.test.ts","packages/workflow-engine/test/fixture.ts","packages/workflow-engine/test/planning-transition.contract.test.ts",